{
  "contract": "ll.control/1",
  "event_id": "control-fixture",
  "request_id": "req-fixture",
  "scope": {
    "course_id": "fixture-course",
    "term": "fixture-term"
  },
  "created_at": "2026-10-03T12:00:00Z",
  "command": {
    "kind": "save_note",
    "text": "Synthetic note, not an assessment.",
    "sources": [],
    "attachments": []
  }
}
